id,submission_time,view_number,vote_number,title,message,image
4,1686853536,10,0,FLASK,What is Flask Python>   ,
3,1686854140,2,-1,FLASK,Why is Flask a good web framework choice?     ,
5,1686854711,3,0,FLASK,How To Make a Web Application Using Flask in Python 3??? :)     ,
6,1686854779,1,3,JiNJA,What is jinja ??      ,static/uploads/c5c4b18f-edd9-47b6-bd3d-5de75fc68f29.jpg
2,1686854792,1,1,Python,How do I convert a curl POST to Python requests.post for a US Patent Office API? 111        ,
7,1686854817,1,0,PYTHON,How to Create a List in Python ?      ,static/uploads/c17e0fa0-ef69-44ff-b160-7df95e6774f9.png
